### ISSUE TITLE
Forward plugin health_check directive is broken

### ISSUE THREAD

**Issue by ltagliamonte-dd** [coredns/coredns#4102]
Forward plugin `health_check` directive is broken.
No matter what value i use for health_check directive there is no healthcheck happening verified with tcdump and sysdig.

This is my current config:
```
    .:53 {
        errors
        health :8081 {
          lameduck 5s
        }
        kubernetes cluster.local. in-addr.arpa ip6.arpa {
          pods insecure
          upstream
          fallthrough in-addr.arpa ip6.arpa
        }
        prometheus :9153
        forward . /etc/resolv.conf
        loop
        cache 30
        loadbalance
        reload
    }
    <MyotherDomain> {
      errors
      cache 30 {
        prefetch 2 1m 20%
      }
      forward . 127.0.0.1:8600 10.4.243.6:8600 {
        policy sequential
        health_check 1s
      }
    }
```

- the version of CoreDNS: 1.6.9

**Comment by chrisohaver** [comment]
Does it work in 1.7.0.?  There was a bug fixed in 1.7.0 related to forward policies that might be related/causing that indirectly.

**Comment by ltagliamonte-dd** [comment]
I checked the code change in 1.7.0 but i don't think it is related.

**Comment by miekg** [comment]
what;s broken. What was tcp dumped. How do we repro?

**Comment by woky** [comment]
@miekg I can confirm. I tested with a LXC container/machine. Then I run Wireshark on lxdbr0 interface snooping on all packets, and after a forwarded request I see nothing more. I'm more interested in meaning of the option though. What exactly is its purpose? Does it apply to only DNS-over-TLS, i.e. for TCP connections? If not, why is the default so short (0.5s)? Anyway, those are question for other place. The main point is that there are no health checks, whatever their purpose is.

EDIT: OK, I lied. There's more, but I can't really understand what's going on.
Configuration:
```
. {
	reload
	forward . tls://1.1.1.1 tls://1.0.0.1 {
		tls_servername cloudflare-dns.com
		health_check 5s
	}
	cache
}
```
Request: `dig @localhost  +noall +answer google.com`
Trace:
```
08:07:54.964909 IP 10.83.28.253.49718 > 1.1.1.1.853: Flags [S], seq 3490807953, win 64240, options [mss 1460,sackOK,TS val 3860321301 ecr 0,nop,wscale 7], length 0
08:07:54.981275 IP 1.1.1.1.853 > 10.83.28.253.49718: Flags [S.], seq 2193286768, ack 3490807954, win 65535, options [mss 1420,nop,nop,sackOK,nop,wscale 10], length 0
08:07:54.981342 IP 10.83.28.253.49718 > 1.1.1.1.853: Flags [.], ack 1, win 502, length 0
08:07:54.981867 IP 10.83.28.253.49718 > 1.1.1.1.853: Flags [P.], seq 1:504, ack 1, win 502, length 503
08:07:55.003961 IP 1.1.1.1.853 > 10.83.28.253.49718: Flags [.], ack 504, win 66, length 0
08:07:55.006367 IP 1.1.1.1.853 > 10.83.28.253.49718: Flags [P.], seq 1:204, ack 504, win 66, length 203
08:07:55.006446 IP 10.83.28.253.49718 > 1.1.1.1.853: Flags [.], ack 204, win 501, length 0
08:07:55.007303 IP 10.83.28.253.49718 > 1.1.1.1.853: Flags [P.], seq 504:568, ack 204, win 501, length 64
08:07:55.007571 IP 10.83.28.253.49718 > 1.1.1.1.853: Flags [P.], seq 568:592, ack 204, win 501, length 24
08:07:55.007700 IP 10.83.28.253.49718 > 1.1.1.1.853: Flags [P.], seq 592:665, ack 204, win 501, length 73
08:07:55.026041 IP 1.1.1.1.853 > 10.83.28.253.49718: Flags [.], ack 568, win 66, length 0
08:07:55.026224 IP 1.1.1.1.853 > 10.83.28.253.49718: Flags [.], ack 592, win 66, length 0
08:07:55.026448 IP 1.1.1.1.853 > 10.83.28.253.49718: Flags [.], ack 665, win 66, length 0
08:07:55.027505 IP 1.1.1.1.853 > 10.83.28.253.49718: Flags [P.], seq 204:1114, ack 665, win 66, length 910
08:07:55.027558 IP 10.83.28.253.49718 > 1.1.1.1.853: Flags [.], ack 1114, win 494, length 0
08:08:00.131910 ARP, Request who-has 10.83.28.1 tell 10.83.28.253, length 28
08:08:00.132024 ARP, Reply 10.83.28.1 is-at 00:16:3e:ed:f9:89, length 28
08:08:00.135142 ARP, Request who-has 10.83.28.253 tell 10.83.28.1, length 28
08:08:00.135267 ARP, Reply 10.83.28.253 is-at 00:16:3e:c3:89:cb, length 28
08:08:05.125002 IP 1.1.1.1.853 > 10.83.28.253.49718: Flags [P.], seq 1114:1138, ack 665, win 66, length 24
08:08:05.125153 IP 10.83.28.253.49718 > 1.1.1.1.853: Flags [.], ack 1138, win 501, length 0
08:08:05.125409 IP 1.1.1.1.853 > 10.83.28.253.49718: Flags [F.], seq 1138, ack 665, win 66, length 0
08:08:05.168499 IP 10.83.28.253.49718 > 1.1.1.1.853: Flags [.], ack 1139, win 501, length 0
08:08:05.211106 IP 1.1.1.1.853 > 10.83.28.253.49718: Flags [F.], seq 1138, ack 665, win 66, length 0
08:08:05.211169 IP 10.83.28.253.49718 > 1.1.1.1.853: Flags [.], ack 1139, win 501, options [nop,nop,sack 1 {1138:1139}], length 0
08:08:12.534129 IP 10.83.28.253.49718 > 1.1.1.1.853: Flags [R.], seq 665, ack 1139, win 501, length 0
```

EDIT2: So the 5s health_check directive is probably not related to the 10s delay for FIN+ACK from CoreDNS. I've tried to set the directive to 13s and the pattern is same, FIN+ACK comes after 10s.
