### ISSUE TITLE
How to use k8s+autopath?

### ISSUE THREAD

**Issue by Quentin-M** [coredns/coredns#1752]
Hi guys,

This is going to be pretty dumb but I am looking at removing the search paths by default from the containers started by Kubernetes (i.e. setting `--cluster-domain=""` in kubelet), while keeping the ability for pods to contact each other or contact the services/endpoints without using fully qualified domain names (e.g. "<service>" vs "<service>.<namespace>.svc.<cluster-domain>").

The reason I am asking is that it can easily take [15+ seconds](https://hastebin.com/turecakoba.swift) for some containers to resolve any name if using all the search domains the kubelets usually inject. This is pretty ridiculous.

In other words, I would like to have CoreDNS try all the usual Kubernetes search domains, by default, on every single request incoming, as fast as possible - rather than having the containers do it (because their libc libraries have really hurtful time-outs).  

Can the `autopath` even be leveraged for that? I am concerned about this particular [condition](https://github.com/coredns/coredns/blob/82d3195f2f593898b6869b0da6c436af3a93665a/plugin/kubernetes/autopath.go#L13-L17).

I have the following configuration right now, but it obviously does not make the trick:
```
    .:5353 {
        errors
        log
        health
        reload

        proxy . /etc/resolv.conf
        prometheus 0.0.0.0:9153

        kubernetes {
            pods verified
            fallthrough
        }
        autopath @kubernetes
    }
```

**Comment by miekg** [comment]
[ Quoting <notifications@github.com> in "[coredns/coredns] How to use k8s+au..." ]
>Hi guys,
>
>This is going to be pretty dumb but I am looking at removing the search paths by default from the containers started by Kubernetes (i.e. setting `--cluster-domain=""` in kubelet), while keeping the ability for pods to contact each other or contact the services/endpoints without using fully qualified domain names (e.g. "<service>" vs "<service>.<namespace>.svc.<cluster-domain>").
>
>The reason I am asking is that it can easily take [15+ seconds](https://hastebin.com/turecakoba.swift) for some containers to resolve any name if using all the search domains the kubelets usually inject. This is pretty ridiculous.

That makes sense, although 15+ seconds *is* kinda crazy, unless something 
*isn't* answering (i.e. timeout). It would be nice to know what is actually 
triggering these long timeout.

>Can the `autopath` even be leveraged for that? I am concerned about this particular [condition](https://github.com/coredns/coredns/blob/82d3195f2f593898b6869b0da6c436af3a93665a/plugin/kubernetes/autopath.go#L13-L17).

In the config your post below this would also match, as kubernetes is 
authoritative for everything below the root (from the `.:5353` zone definition).

>I have the following configuration right now, but it obviously does not make the trick:
>```
>    .:5353 {
>        errors
>        log
>        health
>        reload
>
>        proxy . /etc/resolv.conf
>        prometheus 0.0.0.0:9153
>
>        kubernetes {
>            pods verified
>            fallthrough
>        }
>        autopath @kubernetes
>```

This should do something. What doesn't it do? Note if you have the code anyway 
you can sprinkly log.Debug in the code and enable the `debug` plugin to get 
output.


--
Miek Gieben

**Comment by johnbelamaric** [comment]
So, the way autopath works, it needs the first query to end with <source-pod-namespace>.svc.<cluster-domain>. If it sees that and gets an NXDOMAIN further down the chain, it will try the other elements in the search path until it finds one that works and construct a CNAME.

From the client point of view, you should *not* eliminate the search path in resolv.conf, because then the first query won’t trigger the autopath behavior.

**Comment by Quentin-M** [comment]
Thank you for your answers!

I have changed my configuration to the following:
```
    .:5353 {
        errors
        log
        health
        reload

        kubernetes cluster.local 172.16.0.0/16 172.17.0.0/16 {
            pods verified
            resyncperiod 1m
        }
        cache 10 cluster.local 172.16.0.0/16 172.17.0.0/16
        autopath @kubernetes

        proxy . /etc/resolv.conf
        prometheus 0.0.0.0:9153
    }
```

And now, it seems that the behavior is right, as when an application requests `google.com`, the container queries `google.com.kube-system.svc.cluster.local.` and CoreDNS answers immediately with `CNAME google.com., A 216.58.218.238 (98)` (see below).

```
20:29:10.637791 IP ip-172-16-128-4.us-east-2.compute.internal.37164 > ip-172-17-0-10.us-east-2.compute.internal.domain: 5913+ A? google.com.kube-system.svc.cluster.local. (58)
20:29:10.637816 IP ip-172-16-128-4.us-east-2.compute.internal.37164 > ip-172-17-0-10.us-east-2.compute.internal.domain: 5913+ A? google.com.kube-system.svc.cluster.local. (58)
20:29:10.637881 IP ip-172-16-128-4.us-east-2.compute.internal.37164 > ip-172-17-0-10.us-east-2.compute.internal.domain: 19780+ AAAA? google.com.kube-system.svc.cluster.local. (58)
20:29:10.637883 IP ip-172-16-128-4.us-east-2.compute.internal.37164 > ip-172-17-0-10.us-east-2.compute.internal.domain: 19780+ AAAA? google.com.kube-system.svc.cluster.local. (58)
20:29:10.702067 IP ip-172-17-0-10.us-east-2.compute.internal.domain > ip-172-16-128-4.us-east-2.compute.internal.37164: 5913 2/0/0 CNAME google.com., A 216.58.218.238 (98)

20:29:15.639400 IP ip-172-16-128-4.us-east-2.compute.internal.37164 > ip-172-17-0-10.us-east-2.compute.internal.domain: 5913+ A? google.com.kube-system.svc.cluster.local. (58)
20:29:15.639413 IP ip-172-16-128-4.us-east-2.compute.internal.37164 > ip-172-17-0-10.us-east-2.compute.internal.domain: 5913+ A? google.com.kube-system.svc.cluster.local. (58)
20:29:15.640394 IP ip-172-17-0-10.us-east-2.compute.internal.domain > ip-172-16-128-4.us-east-2.compute.internal.37164: 5913 2/0/0 CNAME google.com., A 216.58.218.238 (98)
20:29:15.640427 IP ip-172-16-128-4.us-east-2.compute.internal.37164 > ip-172-17-0-10.us-east-2.compute.internal.domain: 19780+ AAAA? google.com.kube-system.svc.cluster.local. (58)
20:29:15.640434 IP ip-172-16-128-4.us-east-2.compute.internal.37164 > ip-172-17-0-10.us-east-2.compute.internal.domain: 19780+ AAAA? google.com.kube-system.svc.cluster.local. (58)
20:29:15.713401 IP ip-172-17-0-10.us-east-2.compute.internal.domain > ip-172-16-128-4.us-east-2.compute.internal.37164: 19780 2/0/0 CNAME google.com., AAAA 2607:f8b0:4004:808::200e (110)
20:29:15.751523 IP ip-172-16-128-4.us-east-2.compute.internal.39312 > ip-172-17-0-10.us-east-2.compute.internal.domain: 57252+ A? www.google.com.kube-system.svc.cluster.local. (62)
20:29:15.751541 IP ip-172-16-128-4.us-east-2.compute.internal.39312 > ip-172-17-0-10.us-east-2.compute.internal.domain: 57252+ A? www.google.com.kube-system.svc.cluster.local. (62)
20:29:15.772788 IP ip-172-17-0-10.us-east-2.compute.internal.domain > ip-172-16-128-4.us-east-2.compute.internal.39312: 57252 2/0/0 CNAME www.google.com., A 216.58.217.100 (106)
20:29:15.772839 IP ip-172-16-128-4.us-east-2.compute.internal.39312 > ip-172-17-0-10.us-east-2.compute.internal.domain: 53522+ AAAA? www.google.com.kube-system.svc.cluster.local. (62)
20:29:15.772845 IP ip-172-16-128-4.us-east-2.compute.internal.39312 > ip-172-17-0-10.us-east-2.compute.internal.domain: 53522+ AAAA? www.google.com.kube-system.svc.cluster.local. (62)
20:29:15.788412 IP ip-172-17-0-10.us-east-2.compute.internal.domain > ip-172-16-128-4.us-east-2.compute.internal.39312: 53522 2/0/0 CNAME www.google.com., AAAA 2607:f8b0:4004:805::2004 (118)
```

However, while CoreDNS answers immediately for the A, it looks like it still takes ~5s for the AAAA answer to be generated (log line in CoreDNS appearing) and sent back (tcpdump log line). However, CoreDNS reports having resolved it within 100ms.

Therefore, the client applications still wait ~5s before claiming it has resolved the domain and moving forward. I am not sure whether this is receiving the query and taking 5s to answer (while reporting 100ms) or lost UDP packets (but it does take ~5s systematically, same packet pattern every time).

Time for me to figure this out. Will probably tcpdump CoreDNS next.

**Comment by miekg** [comment]
[ Quoting <notifications@github.com> in "Re: [coredns/coredns] How to use k8..." ]
>However, while CoreDNS answers immediately for the A, it looks like it still takes ~5s for the AAAA answer to be generated (log line in CoreDNS appearing) and sent back (tcpdump log line). However, CoreDNS reports having resolved it within 100ms.
>
>Therefore, the client applications still wait ~5s before claiming it has resolved the domain and moving forward. I am not sure whether this is receiving the query and taking 5s to answer (while reporting 100ms) or lost UDP packets (but it does take ~5s systematically, same packet pattern every time).
>
>Time for me to figure this out. Will probably tcpdump i/o of CoreDNS next.

Thanks!

**Comment by johnbelamaric** [comment]
Just curious, why `fallthrough` on *kubernetes*?

**Comment by chrisohaver** [comment]
`fallthrough` here will cause all nxdomain path checks to get run through the proxy.

e.g. A request for 'google.com' will result in sending the following through the proxy 'google.com.default.svc.cluster.local',  'google.com.svc.cluster.local', and  'google.com.cluster.local', etc

**Comment by Quentin-M** [comment]
It was required for the initial configuration as I did not have a zone filter on the Kubernetes plugin (mostly testing purposes as I was trying to understand autopath). But this indeed might leak DNS requests quite a bit.

**Comment by Quentin-M** [comment]
Back on debugging this today. Here are two interesting tcpdumps at the CoreDNS container and at the container making the DNS request for `google.com`: https://hastebin.com/zisudikavi.swift.

Reading this tcpdump, and as state before, it appears that while the libc make both A/AAAA requests in parallel, but the container only gets one answer back, times-out and re-request the one it did not get an answer for - leading to 5s+ resolutions every-time (potentially multiplied by the number of search domains).

Adding `single-request` or `single-request-reopen` to `resolv.conf` solves the issue on systems that support the option (*Alpine/musl do not*), as shown in the following dumps: https://hastebin.com/wofazosoqa.swift 

So there is either a very surprising network behavior (AWS VPC + Weave's IPSec) that would drop the AAAA query that goes on the socket in parallel with the A query, or it would seem to me that CoreDNS is unable to treat several queries sent in parallel in the same socket?

```
              single-request (since glibc 2.10)
                     Sets RES_SNGLKUP in _res.options.  By default, glibc
                     performs IPv4 and IPv6 lookups in parallel since
                     version 2.9.  Some appliance DNS servers cannot handle
                     these queries properly and make the requests time out.
                     This option disables the behavior and makes glibc
                     perform the IPv6 and IPv4 requests sequentially (at the
                     cost of some slowdown of the resolving process).

              single-request-reopen (since glibc 2.9)
                     Sets RES_SNGLKUPREOP in _res.options.  The resolver
                     uses the same socket for the A and AAAA requests.  Some
                     hardware mistakenly sends back only one reply.  When
                     that happens the client system will sit and wait for
                     the second reply.  Turning this option on changes this
                     behavior so that if two requests from the same port are
                     not handled correctly it will close the socket and open
                     a new one before sending the second request.
```

Edit: I made a second dump on CoreDNS, with less filtering, and the story seems interesting as I don't seem to see the AAAA packet on the first batch? https://hastebin.com/banulayire.swift

**Comment by miekg** [comment]
[ Quoting <notifications@github.com> in "Re: [coredns/coredns] How to use k8..." ]
>So there is either a very surprising network behavior (AWS VPC + Weave's IPSec) that would drop the AAAA query that goes on the socket in parallel with the A query, or it would seem to me that CoreDNS is unable to treat several queries sent in parallel in the same socket?

"in parallel" in this context means, libc will do two looks started at roughly 
the same time, for CoreDNS these are two separate queries and will be treated in 
the same way.

>Edit: I made a second dump on CoreDNS, with less filtering, and the story seems interesting as I don't seem to see the AAAA packet on the first batch? https://hastebin.com/banulayire.swift

with the dump plugin you can see what coredns see in the incoming side 
(coredns.io/explugins/dump).

**Comment by Quentin-M** [comment]
Actually looks related to https://github.com/kubernetes/kubernetes/issues/56903 / https://github.com/kubernetes/kubernetes/issues/62628 / https://tech.xing.com/a-reason-for-unexplained-connection-timeouts-on-kubernetes-docker-abd041cf7e02...

Closing here, as it is a netfilter bug, and not a CoreDNS issue, and as my question regarding autopath was answered.

Thank you so much guys for your work, and your help!

**Comment by Quentin-M** [comment]
Closing here, as it is a netfilter bug, and not a CoreDNS issue, and as my question regarding autopath was answered.

Thank you so much guys for your work, and your help!

**Comment by miekg** [comment]
[ Quoting <notifications@github.com> in "Re: [coredns/coredns] How to use k8..." ]
>Actually looks related to https://github.com/kubernetes/kubernetes/issues/56903 / https://github.com/kubernetes/kubernetes/issues/62628...

Thanks for digging into this.

We need a FAQ or known issues page for these kind of things.

**Comment by tbe** [comment]
I am running in the initial issue again. Used the configuration from https://github.com/coredns/coredns/issues/1752#issuecomment-385241028, but without success.

I still get NXDOMAIN

```
14:07:20.817994 IP 10.39.0.4.39239 > 10.96.0.10.53: 46653+ A? google.de.test-ns-apps.svc.cluster.local. (65)
14:07:20.818173 IP 10.39.0.4.39239 > 10.96.0.10.53: 47793+ AAAA? google.de.test.ns-apps.svc.cluster.local. (65)
14:07:20.819257 IP 10.96.0.10.53 > 10.39.0.4.39239: 47793 NXDomain 0/1/0 (158)
14:07:20.819267 IP 10.96.0.10.53 > 10.39.0.4.39239: 47793 NXDomain 0/1/0 (158)
14:07:20.819275 IP 10.96.0.10.53 > 10.39.0.4.39239: 46653 NXDomain 0/1/0 (158)
14:07:20.819277 IP 10.96.0.10.53 > 10.39.0.4.39239: 46653 NXDomain 0/1/0 (158)
14:07:20.819383 IP 10.39.0.4.32961 > 10.96.0.10.53: 33046+ A? google.de.svc.cluster.local. (45)
14:07:20.819464 IP 10.39.0.4.32961 > 10.96.0.10.53: 34021+ AAAA? google.de.svc.cluster.local. (45)
14:07:20.820724 IP 10.96.0.10.53 > 10.39.0.4.32961: 34021 NXDomain* 0/1/0 (138)
14:07:20.820742 IP 10.96.0.10.53 > 10.39.0.4.32961: 34021 NXDomain* 0/1/0 (138)
14:07:20.820749 IP 10.96.0.10.53 > 10.39.0.4.32961: 33046 NXDomain* 0/1/0 (138)
14:07:20.820751 IP 10.96.0.10.53 > 10.39.0.4.32961: 33046 NXDomain* 0/1/0 (138)
14:07:20.820844 IP 10.39.0.4.56318 > 10.96.0.10.53: 47958+ A? google.de.cluster.local. (41)
14:07:20.820928 IP 10.39.0.4.56318 > 10.96.0.10.53: 49051+ AAAA? google.de.cluster.local. (41)
14:07:20.823794 IP 10.96.0.10.53 > 10.39.0.4.56318: 49051 NXDomain 0/1/0 (134)
14:07:20.823801 IP 10.96.0.10.53 > 10.39.0.4.56318: 49051 NXDomain 0/1/0 (134)
14:07:20.823807 IP 10.96.0.10.53 > 10.39.0.4.56318: 47958 NXDomain 0/1/0 (134)
14:07:20.823809 IP 10.96.0.10.53 > 10.39.0.4.56318: 47958 NXDomain 0/1/0 (134)
```

Any idea how to debug this issue?

**Comment by cuericlee** [comment]
It looks autopath plugin never works to reduce search query after I enable autopath in coredns Corefile. #1752. pod.spec.dnsConfig works for me, but it does not help much for pods which has external access. 

11:10:59.008475 IP 172.16.3.142.53988 > 172.19.0.10.domain: 49326+ A? ngs-raw.oss-cn-beijing-internal.aliyuncs.com.default.svc.cluster.local. (88)
11:10:59.009492 IP 172.16.3.142.60232 > 172.19.0.10.domain: 40379+ A? ngs-raw.oss-cn-beijing-internal.aliyuncs.com.svc.cluster.local. (80)
11:10:59.010141 IP 172.16.3.142.58156 > 172.19.0.10.domain: 28206+ A? ngs-raw.oss-cn-beijing-internal.aliyuncs.com.cluster.local. (76)
11:10:59.010588 IP 172.16.3.142.53887 > 172.19.0.10.domain: 51637+ A? ngs-raw.oss-cn-beijing-internal.aliyuncs.com. (62)

**Comment by chrisohaver** [comment]
@cuericlee, Please share your Corefile. Are you using `pods verified` in your kubernetes plugin options?

If the upstream server returns `NXDOMAIN` for the final name (e.g. in your case, `ngs-raw.oss-cn-beijing-internal.aliyuncs.com.`), the client will still search each domain.  This is a known limitation of the current implementation of autopath.

**Comment by wccsama** [comment]
I have used "autopath @kubernetes" and "pods verified" in plugin kubernetes, but autopath never work to reduce search query. Here is my corefile, am I missing sonething？
`.:53 {
        errors
        health
        log
        reload
        kubernetes cluster.local in-addr.arpa ip6.arpa {
            pods verified
            resyncperiod 1m
        }
        prometheus :9153
        forward . /etc/resolv.conf
        cache 10 cluster.local in-addr.arpa ip6.arpa
        autopath @kubernetes
    }`
