### ISSUE TITLE
Loop check issue in kubernetes

### ISSUE THREAD

**Issue by lentil1016** [coredns/coredns#2229]
Hi, I just boot up a kubernetes 1.12.1 cluster with `kubeadm`, and deployed `calico` as the network plugin, then I found my 1.2.2 coredns run into the following failure.

```
.:53
2018/10/23 10:21:40 [INFO] CoreDNS-1.2.2
2018/10/23 10:21:40 [INFO] linux/amd64, go1.11, eb51e8b
CoreDNS-1.2.2
linux/amd64, go1.11, eb51e8b
2018/10/23 10:21:40 [INFO] plugin/reload: Running configuration MD5 = 9d92cf2a0d82bf7c5cc0b67050e20a31
2018/10/23 10:21:46 [FATAL] plugin/loop: Seen "HINFO IN 7437296346623721150.2435231395082544977." more than twice, loop detected
```

I did the troubleshooting follow #2087 and [this guide](https://coredns.io/plugins/loop/). But it doesn't seems work for me.

Funny thing is, when I run coredns with same config file by docker (except I remove the `kubernetes cluster.local` part from that config file), it works fine. I try run coredns with both docker and kubernetes on the same host. And `tcpdump` their net package, here is the result:

#### config
```shell
.:53 {
    errors
    health
    prometheus :9153
    proxy . 8.8.8.8
    cache 30
    loop
    reload
    loadbalance
}
```
#### log
```shell
./coredns -conf /etc/coredns/Corefile
.:53
2018/10/23 10:17:20 [INFO] CoreDNS-1.2.2
2018/10/23 10:17:20 [INFO] linux/amd64, go1.11, eb51e8b
CoreDNS-1.2.2
linux/amd64, go1.11, eb51e8b
2018/10/23 10:17:20 [INFO] plugin/reload: Running configuration MD5 = 94ab3952ca6965b7e4917a335
^C2018/10/23 10:32:15 [INFO] SIGINT: Shutting down
```
#### tcpdump
```shell
$ tcpdump -i veth449578b         
tcpdump: verbose output suppressed, use -v or -vv for full protocol decode
listening on veth449578b, link-type EN10MB (Ethernet), capture size 262144 bytes
18:17:20.244163 IP 172.17.0.3.58927 > google-public-dns-a.google.com.domain: 6898+ HINFO? 382185177873615028.2947433185199024762. (56)
18:17:20.302356 IP google-public-dns-a.google.com.domain > 172.17.0.3.58927: 6898 NXDomain 0/1/0 (131)
18:18:36.424491 IP6 micro-server-75-64 > ff02::2: ICMP6, router solicitation, length 16
18:27:24.808471 IP6 micro-server-75-64 > ff02::2: ICMP6, router solicitation, length 16
```
#### config
```shell
$ cat /etc/coredns/Corefile 
.:53 {
    errors
    health
    kubernetes cluster.local in-addr.arpa ip6.arpa {
       pods insecure
       upstream
       fallthrough in-addr.arpa ip6.arpa
    }
    prometheus :9153
    proxy . 8.8.8.8
    cache 30
    loop
    reload
    loadbalance
}
```
#### log
```shell
$ ./coredns -conf /etc/coredns/Corefile
.:53
2018/10/23 10:21:40 [INFO] CoreDNS-1.2.2
2018/10/23 10:21:40 [INFO] linux/amd64, go1.11, eb51e8b
CoreDNS-1.2.2
linux/amd64, go1.11, eb51e8b
2018/10/23 10:21:40 [INFO] plugin/reload: Running configuration MD5 = 9d92cf2a0d82bf7c5cc0b67050e20a31
2018/10/23 10:21:46 [FATAL] plugin/loop: Seen "HINFO IN 7437296346623721150.2435231395082544977." more than twice, loop detected
```
#### tcpdump
```shell
$ tcpdump -i calie1baada02ec|grep google
tcpdump: verbose output suppressed, use -v or -vv for full protocol decode
listening on calie1baada02ec, link-type EN10MB (Ethernet), capture size 262144 bytes
18:21:40.523170 IP ACA8001D.ipt.aol.com.speedtrace-disc > google-public-dns-a.google.com.domain: 13901+ HINFO? 7437296346623721150.2435231395082544977. (57)
18:21:43.523468 IP ACA8001D.ipt.aol.com.43650 > google-public-dns-a.google.com.domain: 38479+ HINFO? 7437296346623721150.2435231395082544977. (57)
18:21:45.523419 IP ACA8001D.ipt.aol.com.37968 > google-public-dns-a.google.com.domain: 13901+ HINFO? 7437296346623721150.2435231395082544977. (57)
```

## system info

- kubernetes: 1.12.1
- docker: 18.03.1
- dist: fedora-27
- kernel: 4.17.7-100.fc27.x86_64
```shell
$ kubectl get pods -n kube-system -o yaml|grep image:|awk -F ':' '{print $2":"$3}'|sort|uniq
 k8s.gcr.io/coredns:1.2.2
 k8s.gcr.io/etcd:3.2.24
 k8s.gcr.io/kube-apiserver:v1.12.1
 k8s.gcr.io/kube-controller-manager:v1.12.1
 k8s.gcr.io/kube-proxy:v1.12.1
 k8s.gcr.io/kube-scheduler:v1.12.1
 quay.io/calico/cni:v3.2.3
 quay.io/calico/node:v3.2.3
```

Sorry for I don't know how to reproduce it yet. Is there any more information I may provide? Or any clue I can followed to continuing my debug? Thanks. ❤️

**Comment by chrisohaver** [comment]
Thanks for the detailed report!

Can you describe which interfaces these packet captures were taken from? (i.e. where are they in relation to the interface coredns is bound to)

**Comment by lentil1016** [comment]
@chrisohaver Hi, `veth449578b` and `calie1baada02ec` are both "one side of a veth pair" on host machine, the other side is `eth0` inside the container, also the interface that `coredns` bound to.  `veth449578b` should be created by libnetwork, `calie1baada02ec` should be created by cni, IIRC.

(I'm not sure. But by considering this, I should do checks on `cni` rather than `coredns` didn't I?.... 🤔)

I just test this on another centos7 linux 4.18 private host and a bran-new centos7 linux 3.10 Aliyun ECS host. `docker` and `kubernetes` are both installed for the first time on these host, and they use the same calico manifest.

- [calico.yaml](https://docs.projectcalico.org/v3.2/getting-started/kubernetes/installation/hosted/kubernetes-datastore/calico-networking/1.7/calico.yaml)
- [rbac-kdd.yaml](https://docs.projectcalico.org/v3.2/getting-started/kubernetes/installation/hosted/rbac-kdd.yaml) 

They run into this failure too.

Here is some more information:
```shell
$ getenforce
Disabled 

$ sysctl -p
vm.swappiness = 0
net.bridge.bridge-nf-call-ip6tables = 1
net.bridge.bridge-nf-call-iptables = 1
```

**rpms of kubernetes**
```shell
$ rpm -qa|grep kube
kubectl-1.12.1-0.x86_64
kubernetes-cni-0.6.0-0.x86_64
kubelet-1.12.1-0.x86_64
kubeadm-1.12.1-0.x86_64
```

**Command to boot up kubernetes**
```shell
kubeadm init --kubernetes-version=v1.12.1 --pod-network-cidr=172.168.0.0/16
```

I can give you access to my ECS if necessary.

**Comment by lentil1016** [comment]
Oh! I forgot to set the cidr in official manifest. It's my fault. Sorry for bothering 😭. Closed

My `kubeadm init` command defined cidr to `172.168.0.0/16` and yet [calico.yaml](https://docs.projectcalico.org/v3.2/getting-started/kubernetes/installation/hosted/kubernetes-datastore/calico-networking/1.7/calico.yaml) defined cidr to `192.168.0.0/16`. Which caused this issue.

**Comment by chrisohaver** [comment]
> My kubeadm init command defined cidr to 172.168.0.0/16 and yet calico.yaml defined cidr to 192.168.0.0/16. Which caused this issue.

Thanks for adding that.

Still, that's a bizarre result, the packets being reflected back at CoreDNS.  I can see perhaps dropped packets, or no route to host errors, but reflection back to the originating pod is odd. This is on my "understand why that happens" list.

**Comment by lentil1016** [comment]
> Still, that's a bizarre result, the packets being reflected back at CoreDNS.

As far as I know the packets are not reflected back at CoreDNS. These packets never return to my host. Instead, they were reflected to "ACA80023.ipt.aol.com", like a DNS reflection attack. Because my K8s overlay cidr is 172.168.0.0/16, which is a public IP range.😅

**`tcpdump -i eth0` on host machine**
```shell
$ nslookup ACA80023.ipt.aol.com
Server:		114.114.114.114
Address:	114.114.114.114#53

Non-authoritative answer:
Name:	ACA80023.ipt.aol.com
Address: 172.168.0.35

# "172.168.0.35" also is the address of a coreDNS container.

$ tcpdump -i eno1 |grep 114dns
09:45:12.919798 IP ACA80023.ipt.aol.com.36541 > public1.114dns.com.domain: 26244+ HINFO? 5110024793213496942.531641322967732701. (56)
09:45:16.180916 IP ACA80023.ipt.aol.com.44438 > public1.114dns.com.domain: 63520+ HINFO? 7299446338979321900.2007022264581773901. (57)
09:45:19.179564 IP ACA80023.ipt.aol.com.42750 > public1.114dns.com.domain: 20301+ HINFO? 7299446338979321900.2007022264581773901. (57)
09:45:21.181222 IP ACA80023.ipt.aol.com.35689 > public1.114dns.com.domain: 63520+ HINFO? 7299446338979321900.2007022264581773901. (57)
09:45:37.858940 IP ACA80023.ipt.aol.com.41191 > public1.114dns.com.domain: 8004+ HINFO? 7178469205242395823.7518502463338081918. (57)
09:45:40.859132 IP ACA80023.ipt.aol.com.57851 > public1.114dns.com.domain: 30010+ HINFO? 7178469205242395823.7518502463338081918. (57)
09:45:42.859188 IP ACA80023.ipt.aol.com.33901 > public1.114dns.com.domain: 8004+ HINFO? 7178469205242395823.7518502463338081918. (57)
```
