### ISSUE TITLE
plugin/forward: forward to tls self-hosted coredns server not work

### ISSUE THREAD

**Issue by littleplus** [coredns/coredns#2426]
### Environment:
Both of client and server are in ```Centos 7 x86_64``` with ```CoreDNS 1.3.0```

### Problem:
I could resolve the hostname with ```kdig +tls @server```. But, when I use CoreDNS's plugin forward at client, it could not work.

when I use kdig , there is log in server show with noerror. when I use coredns forward, there's no any log show in server.

#### Client:
```
google.com {
    forward . tls://server{
        force_tcp
    }
    log
}
```
#### Server (the cert and ca cert are self-signed with ip as its hostname):
```
tls://.:853 {
        tls /etc/coredns/coredns.crt /etc/coredns/coredns.key /etc/coredns/ca.crt
        hosts /etc/coredns/hosts {
                fallthrough
        }
        log
        forward . 1.1.1.1 8.8.8.8
}
```

When I use client coredns forward's log and there is no any log show in server:
```
2019-01-02T23:09:37.286+08:00 [INFO] CoreDNS-1.3.0
2019-01-02T23:09:37.287+08:00 [INFO] linux/amd64, go1.11.4, c8f0e94
CoreDNS-1.3.0
linux/amd64, go1.11.4, c8f0e94
2019-01-02T23:09:40.828+08:00 [INFO] 10.0.1.2:60901 - 13307 "A IN www.google.com. udp 32 false 512" SERVFAIL qr,rd 32 1.210567836s
2019-01-02T23:09:40.832+08:00 [INFO] 10.0.1.2:60901 - 13307 "A IN www.google.com. udp 32 false 512" SERVFAIL qr,rd 32 0.213627591s
2019-01-02T23:09:40.855+08:00 [INFO] 10.0.1.2:20849 - 13307 "A IN www.google.com. udp 32 false 512" SERVFAIL qr,rd 32 0.02644381s
```

I try to use tcpdump to debug, but I have no idea:
Success with kdig tcpdump in client:
```
22:40:35.330685 IP client.61308 > server.853: Flags [S], seq 608450174, win 29200, options [mss 1460,sackOK,TS val 4139669014 ecr 0,nop,wscale 9], length 0
22:40:35.345340 IP server.853 > client.61308: Flags [S.], seq 2705609430, ack 608450175, win 63443, options [mss 1424,nop,nop,TS val 3854911046 ecr 4139669014,nop,wscale 6,nop,nop,sackOK], length 0
22:40:35.345398 IP client.61308 > server.853: Flags [.], ack 1, win 58, options [nop,nop,TS val 4139669028 ecr 3854911046], length 0
22:40:35.345806 IP client.61308 > server.853: Flags [P.], seq 1:251, ack 1, win 58, options [nop,nop,TS val 4139669029 ecr 3854911046], length 250
22:40:35.358385 IP server.853 > client.61308: Flags [.], ack 251, win 16384, options [nop,nop,TS val 3854911046 ecr 4139669029], length 0
22:40:35.363433 IP server.853 > client.61308: Flags [.], seq 1:1413, ack 251, win 16407, options [nop,nop,TS val 3854911065 ecr 4139669029], length 1412
22:40:35.363460 IP client.61308 > server.853: Flags [.], ack 1413, win 63, options [nop,nop,TS val 4139669046 ecr 3854911065], length 0
22:40:35.365327 IP server.853 > client.61308: Flags [P.], seq 1413:1499, ack 251, win 16407, options [nop,nop,TS val 3854911065 ecr 4139669029], length 86
22:40:35.365345 IP client.61308 > server.853: Flags [.], ack 1499, win 63, options [nop,nop,TS val 4139669048 ecr 3854911065], length 0
22:40:35.366282 IP client.61308 > server.853: Flags [P.], seq 251:377, ack 1499, win 63, options [nop,nop,TS val 4139669049 ecr 3854911065], length 126
22:40:35.378363 IP server.853 > client.61308: Flags [.], ack 377, win 16407, options [nop,nop,TS val 3854911065 ecr 4139669049], length 0
22:40:35.379323 IP server.853 > client.61308: Flags [P.], seq 1499:1685, ack 377, win 16430, options [nop,nop,TS val 3854911081 ecr 4139669049], length 186
22:40:35.379541 IP client.61308 > server.853: Flags [P.], seq 377:536, ack 1685, win 69, options [nop,nop,TS val 4139669062 ecr 3854911081], length 159
22:40:35.392412 IP server.853 > client.61308: Flags [.], ack 536, win 16430, options [nop,nop,TS val 3854911081 ecr 4139669062], length 0
22:40:35.401408 IP server.853 > client.61308: Flags [P.], seq 1685:1789, ack 536, win 16453, options [nop,nop,TS val 3854911103 ecr 4139669062], length 104
22:40:35.401869 IP client.61308 > server.853: Flags [P.], seq 536:567, ack 1789, win 69, options [nop,nop,TS val 4139669085 ecr 3854911103], length 31
22:40:35.401905 IP client.61308 > server.853: Flags [F.], seq 567, ack 1789, win 69, options [nop,nop,TS val 4139669085 ecr 3854911103], length 0
22:40:35.414383 IP server.853 > client.61308: Flags [.], ack 567, win 16453, options [nop,nop,TS val 3854911103 ecr 4139669085], length 0
22:40:35.415321 IP server.853 > client.61308: Flags [.], ack 568, win 16453, options [nop,nop,TS val 3854911117 ecr 4139669085], length 0
22:40:35.415349 IP server.853 > client.61308: Flags [P.], seq 1789:1820, ack 568, win 16453, options [nop,nop,TS val 3854911117 ecr 4139669085], length 31
22:40:35.415365 IP client.61308 > server.853: Flags [R], seq 608450742, win 0, length 0
22:40:35.417312 IP server.853 > client.61308: Flags [F.], seq 1820, ack 568, win 16453, options [nop,nop,TS val 3854911117 ecr 4139669085], length 0
22:40:35.417330 IP client.61308 > server.853: Flags [R], seq 608450742, win 0, length 0
```

Fail with forward plugin in client:
```
22:39:41.409521 IP client.61218 > server.853: Flags [S], seq 608450174, win 29200, options [mss 1460,sackOK,TS val 4139669014 ecr 0,nop,wscale 9], length 0
22:39:41.418698 IP server.853 > client.61218: Flags [S.], seq 4059671046, ack 729721114, win 63443, options [mss 1424,nop,nop,TS val 3854857144 ecr 4139615087,nop,wscale 6,nop,nop,sackOK], length 0
22:39:41.418783 IP client.61218 > server.853: Flags [.], ack 1, win 58, options [nop,nop,TS val 4139615102 ecr 3854857144], length 0
22:39:41.419155 IP client.61218 > server.853: Flags [P.], seq 1:143, ack 1, win 58, options [nop,nop,TS val 4139615102 ecr 3854857144], length 142
22:39:41.431705 IP server.853 > client.61218: Flags [.], ack 143, win 16384, options [nop,nop,TS val 3854857144 ecr 4139615102], length 0
22:39:41.435653 IP server.853 > client.61218: Flags [.], seq 1:1413, ack 143, win 16407, options [nop,nop,TS val 3854857162 ecr 4139615102], length 1412
22:39:41.435716 IP client.61218 > server.853: Flags [.], ack 1413, win 63, options [nop,nop,TS val 4139615119 ecr 3854857162], length 0
22:39:41.436235 IP client.61218 > server.853: Flags [P.], seq 143:150, ack 1413, win 63, options [nop,nop,TS val 4139615119 ecr 3854857162], length 7
22:39:41.436357 IP client.61218 > server.853: Flags [F.], seq 150, ack 1413, win 63, options [nop,nop,TS val 4139615119 ecr 3854857162], length 0
22:39:41.437589 IP server.853 > client.61218: Flags [P.], seq 1413:1462, ack 143, win 16407, options [nop,nop,TS val 3854857162 ecr 4139615102], length 49
22:39:41.437614 IP client.61218 > server.853: Flags [R], seq 729721256, win 0, length 0
22:39:41.448638 IP server.853 > client.61218: Flags [.], ack 150, win 16407, options [nop,nop,TS val 3854857162 ecr 4139615119], length 0
22:39:41.448686 IP client.61218 > server.853: Flags [R], seq 729721263, win 0, length 0
22:39:41.449615 IP server.853 > client.61218: Flags [.], ack 151, win 16407, options [nop,nop,TS val 3854857176 ecr 4139615119], length 0
22:39:41.449625 IP client.61218 > server.853: Flags [R], seq 729721264, win 0, length 0
22:39:41.449670 IP server.853 > client.61218: Flags [F.], seq 1462, ack 151, win 16407, options [nop,nop,TS val 3854857176 ecr 4139615119], length 0
22:39:41.449675 IP client.61218 > server.853: Flags [R], seq 729721264, win 0, length 0
```

**Comment by johnbelamaric** [comment]
You probably need to use the `tls` option in the client too, since you are not using system-installed CA certs:

```
google.com {
    forward . tls://server{
        tls /etc/coredns/ca.crt
        force_tcp
    }
    log
}
```

Also, force_tcp is meaningless since you only have a `tls` upstream.

**Comment by johnbelamaric** [comment]
FYI, see: https://coredns.io/plugins/forward/

**Comment by xvzup** [comment]
Hi all,

I observe the same behaviour as described by littleplus. I am using CoreDNS 1.3.0

My CoreDNS forwarder is configured as following:

aws.cloud.example.com {
        forward . tls://172.31.42.153:30053 {
            tls CA.pem
        }
        log
    }

and the listening CoreDNS has config:

tls://aws.cloud.example.com:30053 {
    tls cert.pem cert.key CA.pem
    forward . /etc/resolv.conf 
    log
}

The command 
kdig -p 30053 +tls-ca=ca.pem @172.31.42.153 client.aws.cloud.example.com
works fine. 

In the logs of the forwarding CoreDNS instance I see the same SERVFAIL messages.

Thanks!

**Comment by johnbelamaric** [comment]
can you try including the debug and error plugins, it may print out a more useful message

**Comment by xvzup** [comment]
Thx that helped a lot! I had to add appropriate SAN configuration to my certificate. 

I have another question. Is there a way to enforce client authentication? In my scenario the forwarding plugin acts as client and if I configure the forward plugin only with tls parameter ca.pem, then client authentication will be skipped.

**Comment by johnbelamaric** [comment]
Not at this time. What I would like to do is add this to the `firewall` plugin that @fturib is working on in #2335 . The way this would work is that the server would authenticate the client cert, and the issuer and common name would be made available as metadata. Then, in the firewall plugin you can control access based upon the common name.

**Comment by fturib** [comment]
@johnbelamaric : what you mean is that the TLS listener of CoreDNS would add the `tls_issuer` and `tls_common_name` as available Metadata, or maybe the TLS plugin ?

**Comment by johnbelamaric** [comment]
Yes, the tls plugin is a good place for it since it configures the server TLS. We may also want to consider adding a config option to that plugin to control how client certs are handled - see for example the description here https://github.com/infobloxopen/atlas-app-toolkit/pull/64

We should have at least these metadata, I think:
bool `tls/client_present` - client cert is present (but may not be verified)
bool `tls/client_verified` - client cert is a valid cert signed by one of our known CAs
string `tls/client_issuer` - cert issuer name
string `tls/client_common_name` - common name in client cert

I
